{"provider":"codex","title":"테스트 논문","paper_bibliography":"Kim, A. (2026). Test paper. Test Journal, 1(1), 1-2.","bibliographic_info":{"authors":"Kim, A.","year":"2026","journal":"Test Journal","doi":"확인 불가","source_file":"fixture.txt"},"purpose":[{"summary":"한국어 테스트","evidence_quote":"Test evidence.","locator":"Page 1, Test"}],"design_and_participants":[],"methods":[],"key_results":[],"author_conclusion":[],"limitations":[],"reviewer_thoughts":[],"prior_research_problems":[],"study_solution_and_contribution":[],"referenceable_claims":[]}